;ENGLISH;POLISH;RUSSIAN;FRENCH;GERMAN;SPANISH;BRASILIAN;CHINESE_SP;JAPANESE;KOREAN
gui/popup/restart_game_modding;The game needs to be restarted to apply changes. Are you sure you wish to restart the game?;Aby zastosować zmiany, należy ponownie uruchomić grę. Czy na pewno chcesz zrestartować grę?;Для применения изменений требуется перезапуск игры. Вы уверены, что хотите перезапустить игру?;Le jeu doit être redémarré pour appliquer les modifications. Voulez-vous vraiment redémarrer le jeu ?;Um die Änderungen zu übernehmen, muss das Spiel neu gestartet werden. Möchtest du das Spiel wirklich neu starten?;El juego se debe reiniciar para aplicar los cambios. ¿Seguro que quieres reiniciarlo?;O jogo precisa ser reiniciado para que as mudanças sejam aplicadas. Tem certeza de que deseja reiniciar o jogo?;需要重新启动游戏才能应用更改。 您确定要重启游戏吗？;変更を適用するにはゲームを再開する必要があります。本当にゲームを再開しますか？;변경 사항을 적용하려면 게임을 다시 시작해야 합니다. 게임을 다시 시작하시겠습니까?
gui/popup/safe_mode;The Riftbreaker did not shutdown properly the last time it was launched. Would you like to start the game in Safe-Mode? This will disable all of your Mods and will reset all graphics settings to their default values. This WILL NOT reset your gameplay and controls settings.;The Riftbreaker nie wyłączył się prawidłowo przy ostatnim uruchomieniu. Czy chciałbyś uruchomić grę w trybie bezpiecznym? To wyłączy wszystkie twoje mody i przywróci wszystkie ustawienia graficzne do wartości domyślnych. To NIE zresetuje twoich ustawień gry i sterowania.;Игра The Riftbreaker была некорректно завершена при последнем запуске. Хотите запустить игру в безопасном режиме? Все моды будут отключены, а графические настройки сброшены на стандартные значения. Настройки игрового процесса и управления НЕ БУДУТ сброшены.;The Riftbreaker ne s'est pas arrêté correctement lors de sa dernière utilisation. Voulez-vous démarrer le jeu en mode sans échec ? Tous vos mods seront désactivés et les paramètres graphiques seront restaurés par défaut. Les paramètres de jouabilité et les commandes NE SERONT PAS réinitialisés.;Der Riftbreaker wurde beim letzten Start nicht ordnungsgemäß beendet. Möchtest du das Spiel im abgesicherten Modus starten? Dadurch werden all deine Mods deaktiviert und alle Grafikeinstellungen auf die Standardwerte zurückgesetzt. Deine Spiel- und Steuerungseinstellungen werden dabei NICHT zurückgesetzt.;The Riftbreaker no se cerró correctamente la última vez que se inició. ¿Te gustaría iniciar el juego en modo seguro? Se desactivarán todas las modificaciones y los gráficos volverán a los valores predeterminados. Los ajustes de controles y mecánica no se restablecerán.The Riftbreaker no se cerró correctamente la última vez que se inició. ¿Te gustaría iniciar el juego en modo seguro? Se desactivarán todas las modificaciones y los gráficos volverán a los valores predeterminados. Los ajustes de controles y mecánica no se restablecerán.;The Riftbreaker não foi encerrado corretamente na última vez. Você gostaria de iniciar o jogo em Modo de Segurança? Este modo desabilita todos os seus mods e restaura todas as configurações gráficas aos valores padrão. Isso não restaurará suas configurações de jogabilidade e de controle.;银河破裂者在上次启动时没有正常关闭。你想在安全模式下启动游戏吗？这将禁用您所有的Mods，并将所有图形设置重置为默认值。这不会重置您的游戏和控制设置。;最後にプレイされた際、The Riftbreakerは適切に終了されませんでした。ゲームをセーフモードで開始しますか？このモードでは全てのMODが無効になり、全てのグラフィック設定がリセットされます。ゲームプレイと操作設定はリセットされません。;리프트브레이커가 제대로 종료되지 않았습니다. 게임을 안전 모드로 시작하시겠습니까? 모든 모드를 사용할 수 없게 되며 모든 그래픽 설정이 기본값으로 초기화됩니다. 게임 플레이 및 조작 설정은 초기화되지 않습니다.
gui/popup/safe_mode_launcher;This will disable all of your Mods and will reset all graphics settings to their default values. This WILL NOT reset your gameplay and controls settings.;Funkcja ta wyłączy wszystkie twoje mody i zresetuje wszystkie ustawienia graficzne do wartości domyślnych. To NIE zresetuje ustawień gry i sterowania.;Все моды будут отключены, а графические настройки сброшены на стандартные значения. Настройки игрового процесса и управления НЕ БУДУТ сброшены.;Tous vos mods seront désactivés et les paramètres graphiques seront restaurés par défaut. Les paramètres de jouabilité et les commandes NE SERONT PAS réinitialisés.;Dadurch werden all deine Mods deaktiviert und alle Grafikeinstellungen auf die Standardwerte zurückgesetzt. Deine Spiel- und Steuerungseinstellungen werden dabei NICHT zurückgesetzt.;Se desactivarán todas las modificaciones y los gráficos volverán a los valores predeterminados. Los ajustes de controles y mecánicas no se restablecerán.;Este modo desabilita todos os seus mods e restaura todas as configurações gráficas aos valores padrão. Isso não restaurará suas configurações de jogabilidade e de controle.;这将禁用您的所有Mod，并将所有图形设置重置为其默认值。这不会重置你的游戏性和控制设置。;全てのMODが無効になり、全てのグラフィック設定がリセットされます。ゲームプレイと操作設定はリセットされません。;모든 모드를 사용할 수 없게 되며 모든 그래픽 설정이 기본값으로 초기화됩니다. 게임 플레이 및 조작 설정은 초기화되지 않습니다.
gui/popup/terms_of_use/email_code;Verification code sent to your e-mail.;Kod weryfikacyjny wysłany na Twój e-mail.;Код проверки отправлен вам по электронной почте.;Un code de vérification a été envoyé à votre adresse e-mail.;Der Verifizierungscode wird dir per E-Mail zugeschickt.;Código de verificación enviado a tu correo electrónico.;O código de verificação foi enviado ao seu endereço de e-mail.;验证码已发送到您的电子邮件。;認証コードがメールアドレスに送信されました。;해당 이메일로 인증 코드를 발송했습니다.
gui/popup/terms_of_use/error;There was an error while processing your request: ${error_code};Podczas przetwarzania Twojego żądania wystąpił błąd: ${error_code}.;При обработке запроса возникла ошибка: ${error_code};Une erreur est survenue lors du traitement de votre demande : ${error_code};Bei der Bearbeitung deiner Anfrage ist ein Fehler aufgetreten: ${error_code};Se ha producido un error al procesar la solicitud: ${error_code};Houve um erro ao processar sua solicitação: ${error_code};在处理您的请求时出现了错误：${错误代码}。;リクエストの処理中にエラーが発生しました：${error_code};플레이어의 요청 사항을 처리하는 도중 오류가 발생했습니다: ${error_code}
gui/popup/terms_of_use/modio;We use mod.io to support user-generated content in-game. By clicking 'I Agree' you agree to the mod.io Terms of Use and a mod.io account will be created for you. Please see the mod.io Privacy Policy on how mod.io processes your personal data.;Używamy mod.io do obsługi treści generowanych przez użytkowników w ramach gry. Klikając "Zgadzam się", zgadzasz się na Warunki korzystania z mod.io i zostanie dla Ciebie utworzone konto mod.io. Zapoznaj się z Polityką prywatności mod.io, aby dowiedzieć się, jak mod.io przetwarza Twoje dane osobowe.;Для поддержки созданного пользователями содержимого в игре используется платформа mod.io. Нажимая «Я соглашаюсь», вы соглашаетесь с Условиями использования mod.io. После этого для вас будет создана учетная запись mod.io. Сведения об обработке персональных данных платформой mod.io смотрите в Политике конфиденциальности mod.io.;Nous utilisons mod.io pour prendre en charge le contenu généré par les utilisateurs dans le jeu. En cliquant sur « Accepter », vous acceptez les Conditions d'utilisation de mod.io et un compte sera créé pour vous. Veuillez lire la Politique de confidentialité de mod.io pour savoir comment mod.io traite vos données personnelles.;Wir verwenden mod.io, um nutzergenerierte Inhalte im Spiel zu unterstützen. Wenn du auf „Ich stimme zu“ klickst, erklärst du dich mit den mod.io-Nutzungsbedingungen einverstanden und es wird ein mod.io-Konto für dich erstellt. Wie mod.io deine persönlichen Daten verarbeitet, entnimm bitte der mod.io-Datenschutzrichtlinie.;Usamos mod.io para respaldar el contenido generado por el usuario en el juego. Al hacer clic en Acepto, aceptas las Condiciones de uso de mod.io, así como la creación de una cuenta de mod.io. Consulta la Política de privacidad de mod.io para descubrir cómo mod.io procesa los datos personales.;Usamos o mod.io para dar suporte a conteúdos criados por jogadores. Clicando em "Concordo", você aceita os Termos de Uso da mod.io e uma conta da mod.io será criada. Confira a Política de Privacidade da mod.io para saber como ela processa seus dados pessoais.;我们使用mod.io来支持用户在游戏中生成的内容。通过点击 "我同意"，你同意mod.io的使用条款，并且将为你创建一个mod.io账户。请参阅mod.io隐私政策，了解mod.io如何处理你的个人数据。;ユーザーによって作られたコンテンツをゲーム内で利用するためにmod.ioが使われています。「承諾する」をクリックするとmod.ioの利用規約を承諾することとなり、mod.ioアカウントが作られます。個人データの利用に関してはmod.ioのプライバシーポリシーをご参照ください。;저희는 사용자가 생성하는 게임 내 콘텐츠를 지원하기 위해 mod.io를 사용하고 있습니다. '동의'를 클릭하면 mod.io의 이용약관에 동의하게 되고 mod.io 계정이 생성됩니다. 사용자의 개인 정보가 어떻게 처리되는지 확인하려면 mod.io의 개인정보 처리방침을 확인해 주세요.
gui/popup/xbox_save_sync;The console is currently busy synchronizing your user state and we are unable to continue. Please wait and try again in a moment. If the problem persists, please report it by going to: XBOX Assist -> Get Help -> Find more help online. Warning: Restarting the console before synchronization is completed may cause your progres to be lost.;Konsola jest obecnie zajęta synchronizacją stanu użytkownika i nie możemy kontynuować. Prosimy poczekać i spróbować ponownie za chwilę. Jeśli problem nadal występuje, prosimy o zgłoszenie go, przechodząc do: XBOX Assist -> Get Help -> Znajdź więcej pomocy online. Ostrzeżenie: Ponowne uruchomienie konsoli przed zakończeniem synchronizacji może spowodować utratę Twoich postępów.;Невозможно продолжить, так как в настоящий момент консоль выполняет синхронизацию данных пользователя. Повторите попытку через некоторое время. Если проблема сохраняется, сообщите о ней в разделе «Служба поддержки Xbox» -> «Получить поддержку» -> «Получить поддержку онлайн». Внимание! Перезагрузка консоли до завершения синхронизации может привести к потере прогресса в игре.;La console synchronise actuellement votre état d'utilisateur et ne peut pas continuer. Veuillez réessayer ultérieurement. Si le problème persiste, merci de le signaler à Support Xbox : Support Xbox > Obtenir de l'aide > Obtenir plus d'aide en ligne. Attention : si vous redémarrez la console avant que la synchronisation ne soit terminée, vous pourriez perdre votre progression.;Die Konsole ist gerade damit beschäftigt, deinen Benutzerstatus zu synchronisieren, und wir können nicht fortfahren. Bitte habe Geduld und versuche es in einem Augenblick erneut. Wenn das Problem weiterhin besteht, melde es bitte unter: XBOX Assist -> Hilfe erhalten -> Weitere Hilfe findest du online. Achtung! Wenn du die Konsole neu startest, bevor die Synchronisierung abgeschlossen ist, können deine Fortschritte verloren gehen.;La consola está ocupada sincronizando el estado del usuario y no hemos podido continuar. Espera y vuelve a intentarlo dentro de unos minutos. Si el problema persiste, comunícalo: Asistencia de Xbox > Obtener ayuda > Buscar más ayuda en línea. Advertencia: si reinicias la consola antes de completar la sincronización, el progreso puede perderse.;No momento, o console está ocupado sincronizando seu estado de usuário e não podemos continuar. Espere um pouco e tente novamente. Se o problema persistir, relate-o aqui: Suporte do Xbox -> Obter ajuda -> Obter ajuda online. Aviso: reiniciar o console antes da conclusão da sincronização pode provocar perda de progresso.;控制台当前正忙于同步您的用户状态，我们无法继续。请稍后重试。如果问题仍然存在，请通过以下方式报告：XBOX助手 -> 获取帮助 -> 在线查找更多帮助。警告：在同步完成之前重新启动控制台可能会导致你的进度丢失。;現在、ユーザー情報の同期により続行することができません。しばらくしてからもう一度試してください。もし問題が解消されない場合は、XBOXアシスト -> ヘルプ -> オンラインヘルプから報告してください。警告：同期が完了する前に再開すると進捗が失われることがあります。;콘솔은 현재 사용자 상태를 동기화하고 있기 때문에 계속할 수 없습니다. 잠시 기다렸다가 다시 시도해 주세요. 문제가 계속해서 발생한다면 Xbox 지원 > 도움받기 > 온라인에서 도움 더 보기에서 신고해 주세요. 경고: 동기화가 완료되기 전에 콘솔을 다시 시작하면 진행 상황을 잃게 될 수 있습니다.
gui/popup/xbox_save_sync_header;WARNING!;OSTRZEŻENIE!;ВНИМАНИЕ!;ATTENTION !;ACHTUNG!;¡ADVERTENCIA!;AVISO!;警告!;警告！;경고!
launcher/button/safe_mode;Safe Mode;Tryb bezpieczny;Безопасный режим;Mode sans échec;Abgesicherter Modus;Modo seguro;Modo de Segurança;安全模式;セーフモード;안전 모드
launcher/label/disable_mods;Disable all Mods;Wyłącz wszystkie mody;Отключить все моды;Désactiver tous les mods;Alle Mods deaktivieren;Desactivar las modificaciones;Desabilitar todos os mods;禁用所有模式;全てのMODを無効にする;모든 모드 비활성화
launcher/label/reset_config_values;Reset configuration values;Zresetuj ustawienia konfiguracyjne;Сбросить значения настроек;Restaurer les valeurs de configuration;Konfigurationswerte zurücksetzen;Restablecer valores de configuración;Redefinir valores de configuração;重置配置值;設定値のリセット;설정값 초기화
monster_description/arachnoid_crystal;Arachnomortus is a formidable opponent, sporting a powerful and unique method of attack. By utilizing the innate properties of synthesized crystals, the Arachnomortus is able to launch razor-sharp crystal shards at its targets with incredible accuracy and speed.;Arachnomortus to groźny przeciwnik, który dysponuje potężną i unikalną metodą ataku. Wykorzystując wyjątkowe właściwości zsyntetyzowanych kryształów, Arachnomortus jest w stanie wystrzelić w swój cel ostre jak brzytwa odłamki kryształu z niesamowitą dokładnością i szybkością.;Арахномортус — опасный противник с уникальным и очень мощным способом атаки. Он может синтезировать кристаллы и запускать их острейшие фрагменты с невероятной скоростью и меткостью.;Les arachnomortus sont de formidables adversaires à la méthode d'attaque puissante et unique. Ils utilisent les propriétés naturelles des cristaux synthétisés pour lancer à grande vitesse des éclats de cristaux tranchants comme des rasoirs de manière très précise.;Der Arachnomortus ist ein furchterregender Gegner, der über eine mächtige und einzigartige Angriffsmethode verfügt. Durch die Nutzung der angeborenen Eigenschaften synthetischer Kristalle kann der Arachnomortus rasiermesserscharfe Kristallsplitter mit unglaublicher Präzision und Geschwindigkeit auf seine Ziele schleudern.;El arachnomortus es un rival formidable, con un modo de ataque único y poderoso. Utiliza las propiedades inherentes de los cristales sintetizados y puede lanzar esquirlas de cristal afiladísimas a sus objetivos con precisión y velocidades increíbles.;O Aracnomortus é um oponente formidável que conta com um método de ataque poderoso e singular. Utilizando as propriedades inatas de cristais sintetizados, ele é capaz de lançar fragmentos de cristal afiados contra seus alvos com precisão e velocidade incríveis.;水晶蛛是一类强大的对手，其具有一种强大且独特的攻击方式。通过利用合成水晶的固有属性，水晶蛛能够以惊人的准确性和速度向目标发射锐利的水晶碎片。;アラクノモータスは強力で独特な攻撃法を持つ、並々ならぬ敵だ。合成結晶ならでは特質を利用し、アラクノモータスは鋭い結晶の破片を敵に向かって驚くほどの正確さとスピードで放ってくる。;아라크노몰터스는 만만찮은 적으로 강력하고 특별한 공격을 선사합니다. 크리스털을 합성하는 선천적인 특성을 사용해서 면도날처럼 날카로운 크리스털 조각을 놀라운 정확도와 속도로 목표물에 발사할 수 있습니다.
monster_description/canoptrix_crystal;Canomortus are small, crystal-infused creatures resembling Canoptrix. They can be summoned by Necrodons through unknown means, and their bodies are fused with crystalline growths. They exhibit similar territorial behavior, attacking any intruders with sharp claws and strong jaws. Despite their small size, their bodies are incredibly resilient due to the crystal infusion, making them difficult to defeat.;Canomortus to małe, naszpikowane kryształami stworzenia przypominające Canoptrixy. Mogą być przywoływane przez Necrodony w niewyjaśniony sposób, a ich ciała są porośnięte kryształami. Wykazują podobne zachowania terytorialne, atakując każdego intruza ostrymi pazurami i silnymi szczękami. Pomimo niewielkich rozmiarów, ich ciała są niesamowicie wytrzymałe.;Каномортусы — небольшие, покрытые кристаллическими наростами существа, напоминающие каноптриксов. Они также демонстрируют схожее поведение в отношении своей территории, которую защищают от чужаков острыми зубами и когтями. Несмотря на скромные размеры, их тела невероятно прочны из-за вкраплений кристаллов, что делает их сильными противниками. Некродоны могут призывать их неизвестным нам способом.;Les canomortus sont des petites créatures imprégnées du pouvoir des cristaux dont le corps présente des excroissances cristallines. Les nécrodons peuvent les invoquer par des moyens inconnus. Les canomortus ressemblent aux canoptrix et ont un comportement territorial similaire : ils attaquent tout intrus de leurs griffes acérées et de leurs puissantes mâchoires. Malgré leur petite taille, ils sont incroyablement résistants et coriaces grâce à l'imprégnation de cristal.;Die Canomortus sind kleine, von Kristallen durchdrungene Kreaturen, die Canoptrix ähneln. Sie können von Nekrodonen auf unerforschte Weise beschworen werden und ihre Körper sind mit kristallinen Wucherungen verschmolzen. Sie zeigen ein ähnliches territoriales Verhalten und greifen jeden Eindringling mit scharfen Klauen und starken Kiefern an. Trotz ihrer geringen Größe sind ihre Körper aufgrund der Kristallinfusion unglaublich widerstandsfähig, wodurch sie schwer zu besiegen sind.;Los canomortus son criaturas pequeñas impregnadas de cristal que recuerdan a los canoptrix. Los necrodon pueden invocarlos con medios desconocidos y sus cuerpos se fusionan con masas cristalinas. Tienen un comportamiento territorial similar y atacan a los intrusos con garras afiladas y mandíbulas fuertes. A pesar de su tamaño reducido, sus cuerpos son increíblemente resistentes debido al cristal, lo que los hace difíciles de vencer.;Os Canomortus são pequenas criaturas infundidas em cristal que lembram os Canoptrix. Eles podem ser convocados por Necrodons (por meios desconhecidos) e apresentam protuberâncias cristalinas. Seu comportamento também é territorial — eles atacam qualquer invasor com sua mandíbula forte e garras afiadas. Apesar do seu tamanho, seus corpos são muito resistentes devido à infusão cristalina, tornando-os difíceis de se combater.;水晶兽是小型的，与赤甲兽类似的水晶融入生物。他们可以被亡灵召唤者以未知的方式被召唤，身体与晶体生长融合。他们表现出类似的领地行为，用锐利的爪子和强壮的下颚攻击任何侵入者。尽管体积较小，但身体由于与水晶融合而非常强大，使得他们难以击败。;カノプトリクスに似たカノモータスは、結晶を体内に取り込んだ小型生物だ。未知の方法でネクロドンによって召喚されるカノモータスの体には結晶の塊が見られる。その縄張り行動は似たもので、侵入してくる生物を鋭い爪と強力な顎で攻撃する。小型ながらも、結晶融合により耐性の高い体を持つカノモータスは、手強い敵である。;캐노몰터스는 캐놉트릭스와 유사하고 작으며 크리스털에 영향을 받았습니다. 네크로돈이 알 수 없는 방법으로 이 생명체를 소환할 수 있으며, 캐노몰터스의 몸은 크리스털 성장에 영향을 받습니다. 유사한 영역 행동 양식을 보이고 날카로운 발톱과 강력한 턱으로 침입자를 공격합니다. 작은 크기에도 불구하고 크리스털이 주입된 단단한 체구 때문에 쓰러뜨리는 게 쉽지 않습니다.
