;ENGLISH;POLISH;RUSSIAN;FRENCH;GERMAN;SPANISH;BRASILIAN;CHINESE_SP;JAPANESE;KOREAN
gui/hud/building_name/pipe_area_tool;Pipe Area Tool;;Инструмент постройки труб на области;;;;;;;
gui/hud/building_description/pipe_area_tool;This tool allows you to build pipes on a selected area.;;Этот инструмент позволяет строить труб на выделенной области.;;;;;;;
;;;;;;;;;;
gui/hud/building_name/pipe_diagonal_tool;Pipe Diagonal Tool;;Инструмент постройки диагональных труб;;;;;;;
gui/hud/building_description/pipe_diagonal_tool;This tool allows you to build diagonal pipes.;;Этот инструмент позволяет строить диагональные трубы.;;;;;;;