;ENGLISH;POLISH;RUSSIAN;FRENCH;GERMAN;SPANISH;BRASILIAN;CHINESE_SP;JAPANESE;KOREAN
gui/hud/building_name/sell_place_ruins_tool;Sell and Place Ruins Tool;;Продать и оставить руины;;;;;出售工具-出售后留下废墟;;
gui/hud/building_description/sell_place_ruins_tool;This tool allows you to sell Buildins and place Ruins.;;Этот инструмент позволяет продавать здания и оставлять руины.;;;;;这个工具允许玩家出售建筑后留下废墟.;;
;;;;;;;;;;
gui/hud/building_name/sell_ruins_eraser_tool;Ruins Eraser Tool;;Инструмент удаления руин;;;;;出售工具-拆除废墟;;
gui/hud/building_description/sell_ruins_eraser_tool;This tool allows you to remove ruins.;;Этот инструмент позволяет удалять руины с выделенной территории.;;;;;这个工具允许玩家拆除废墟.;;