;ENGLISH;POLISH;RUSSIAN;FRENCH;GERMAN;SPANISH;BRASILIAN;CHINESE_SP;JAPANESE;KOREAN
gui/hud/building_name/eraser_rocks;Rocks Eraser Tool;;Инструмент удаления скал;;;;;;;
gui/hud/building_description/eraser_rocks;This tool allows you to remove rocks.;;Этот инструмент позволяет удалять скалы с выделенной территории.;;;;;;;
;;;;;;;;;;
gui/hud/building_name/eraser_rocks_and_flora;Rocks and Flora Eraser Tool;;Инструмент удаления скал и флоры;;;;;;;
gui/hud/building_description/eraser_rocks_and_flora;This tool allows you to remove rocks and flora.;;Этот инструмент позволяет удалять скалы и флору с выделенной территории.;;;;;;;